{
  "schema_name": "trustforge_trust_score",
  "schema_version": "0.1.0",
  "service_id": "onesource_api_chain_id",
  "window": {
    "type": "bootstrap",
    "from_utc": "2026-06-14T01:17:40.788Z",
    "to_utc": "2026-06-14T01:17:40.788Z"
  },
  "dimensions": {
    "correctness": 1,
    "reliability": 1,
    "payment_integrity": 1,
    "latency": 0,
    "safety": 1
  },
  "composite": 1,
  "sample_size": 1,
  "confidence": "low",
  "regression_flag": false,
  "methodology_version": "trustforge-bootstrap-v0.1.0",
  "commercial_disclosure": {
    "evaluated_service_is_customer": false,
    "relationship_type": "none",
    "seller_funded_probes": false,
    "seller_funded_probe_share": 0,
    "score_methodology_unchanged": true,
    "disclosure_notes": "Bootstrap external paid probe."
  },
  "evidence_refs": [
    "evaluation:onesource_chain_id__t0c_20260613_215339__onesource_api_chain_id__ethereum_chain_id_v1",
    "probe:onesource_chain_id__t0c_20260613_215339"
  ],
  "created_at_utc": "2026-06-14T01:21:01.694Z"
}
